{
  "schema_version": "1.0.0",
  "license": "CC-BY-4.0",
  "updated_at": "2026-08-12",
  "project_state": "IN_PROGRESS",
  "phase": "E1",
  "lot": "public-ir-0.1-and-20-graph-replay",
  "remote": {
    "canonical_name": "origin",
    "canonical_url": "https://github.com/aminoside/morphoia.git",
    "repository": "Aminoside/morphoia",
    "visibility": "public",
    "default_branch": "main",
    "integration_branch": "engine",
    "publication_status": "PASS",
    "publication_note": "Public-IR entry checkpoint a69d35b5e2c971ff44153eb902f62dd8e3c89fea is published on engine-p0-public-ir-replay; PR 8 targets engine only, Engine run 31596165398 and report run 31596165378 passed on the exact SHA"
  },
  "git": {
    "branch": "engine-p0-public-ir-replay",
    "upstream": "origin/engine-p0-public-ir-replay",
    "base_parent": "12656708ccc3031670c4b3efd43996e46fa27998",
    "integration_branch_initially_present": false,
    "branch_protection_observed": false,
    "published_commit_sha": "a69d35b5e2c971ff44153eb902f62dd8e3c89fea",
    "note": "The work branch starts from exact engine merge 12656708; entry checkpoint a69d35b5 has tree ce7f7a6e and passed its exact-head Engine and report workflows"
  },
  "tasks": {
    "completed": [
      "repository_identity_remote_and_permission_audit",
      "initial_branches_tags_pull_requests_releases_and_workflows_audit",
      "preexisting_worktree_preservation",
      "capability_and_resource_probe",
      "baseline_hash_page_and_archive_verification",
      "requirements_320_exact_extraction_and_tracking_split",
      "requirements_schema_semantic_and_mutation_tests",
      "governance_security_and_e9_memory",
      "native_cpp20_c11_abi_shared_bootstrap",
      "cmake_3_20_install_and_external_consumer",
      "unified_python_50_test_suite",
      "immutable_pdf_baseline_and_generated_report_policy_separation",
      "asan_ubsan_fail_fast_smoke",
      "deterministic_cyclonedx_source_sbom",
      "reuse_161_file_license_metadata_lint",
      "bounded_secret_signature_scan",
      "versioned_e0_gate_report",
      "authenticated_checkpoint_publication_and_remote_tree_verification",
      "first_hosted_check_execution_and_failure_capture",
      "retained_layout_ci_correction_and_hosted_reverification",
      "e0_durable_evidence_integrated_in_pr4",
      "engine_integration_after_green_checks",
      "engine_push_post_merge_verification",
      "e1_native_canonical_json_sha256_posix_cas_implementation",
      "e1_native_adversarial_review",
      "e1_source_publication",
      "e1_first_hosted_failure_capture",
      "e1_profile_separated_durable_evidence_correction",
      "e1_corrective_hosted_verification",
      "e1_final_evidence_head_engine_verification",
      "e2_protocol_contract_hosted_correction",
      "e2_final_evidence_head_verification",
      "e2_protocol_contract_engine_integration",
      "e2_engine_push_post_merge_verification",
      "e1_e2_semantic_merge_reconciliation",
      "e1_e2_combined_hosted_engine_and_report_verification",
      "e1_pr7_review_thread_verification",
      "e1_engine_integration_after_green_checks",
      "e1_engine_push_post_merge_verification",
      "public_ir_lot_branch_creation_and_entry_smoke",
      "legacy_prototype_entry_hash_freeze",
      "e1_native_evidence_byte_freeze",
      "e1_public_ir_entry_checkpoint",
      "e1_public_ir_entry_checkpoint_publication",
      "e1_public_ir_entry_hosted_verification"
    ],
    "in_progress": [
      "e1_public_ir_track_a_schema_contract_corpus",
      "e1_public_ir_track_b_native_abi_python_cli_replay",
      "e1_public_ir_track_c_traceability_sbom_evidence"
    ],
    "remaining": [
      "e1_remaining_core_foundations",
      "e2_real_salome_execution_when_runtime_available"
    ]
  },
  "environment": {
    "os": "Ubuntu 24.04.3 LTS",
    "kernel": "Linux 6.18.35",
    "architecture": "x86_64",
    "effective_cpus": 8,
    "cgroup_ram_gib": 20,
    "free_disk_gib_at_probe": 54,
    "compiler": "GCC and G++ 13.3.0",
    "cxx": "C++20 syntax and runtime smoke PASS",
    "openmp": "GCC OpenMP 4.5 available",
    "python": "3.12.13",
    "cmake_validation": "hash-locked CMake 3.20.5",
    "reuse_validation": "hash-locked REUSE 6.2.0 with Poetry Core 2.4.1 build backend",
    "pdf_text_validation": "pdftotext 24.02.0 from poppler-utils 24.02.0-1ubuntu9.9 executed locally; hosted replay uses the retained hash-verified layout and passed without requiring pdftotext",
    "network": "restricted allowlisted egress; authenticated repository connector available; unrestricted public egress not probed",
    "github_hosted_state": "no initial Engine branch, tag, or release; unrelated draft PR 3 preserved; existing report workflow and green default-branch run observed",
    "github_quotas": "NOT_RUN: Actions, artifact, LFS, storage, and API quota limits were not exposed by the connector",
    "missing_or_unobserved": [
      "ninja",
      "pkg-config",
      "gh",
      "SALOME 9.16",
      "NVIDIA GPU/runtime",
      "AMD GPU/runtime",
      "Intel GPU/runtime",
      "container runtime",
      "Slurm/EuroHPC",
      "OCCT/VTK/ITK/PDAL/MED/Kokkos/PETSc and other domain libraries"
    ]
  },
  "source_digests": {
    "algorithm": "sha256 over sorted path, NUL, file sha256, LF records",
    "excluded": [
      "docs/engine/checkpoint.json"
    ],
    "paths": [
      {
        "path": "cpp",
        "sha256": "9571b44d03541a91d8aa955a743039c029bf37c292791b8c9a517c4246d87220",
        "status": "PASS"
      },
      {
        "path": "spec",
        "sha256": "439953618d6853649e703ff261e5687ef20218feed9740ef4baa0de09182c10f",
        "status": "PASS"
      },
      {
        "path": "docs/engine",
        "sha256": "b58e11627c02310a373cd8e8af4b01309ad9a7320d8a5f8d1e823d41a22ba3f2",
        "status": "PASS"
      }
    ],
    "note": "Digests represent the public-IR lot entry after E1 and E2 integration; checkpoint.json itself is excluded to avoid self-reference. Closed E0 and E1 native outputs are byte-frozen, E2 remains a separate closed profile, and ADR-020 is proposed without executable public-IR evidence."
  },
  "commands": [
    {
      "command": "MORPHOIA_BOOTSTRAP_FORCE_FALLBACK=1 ./scripts/bootstrap-engine.sh (two isolated runs)",
      "result": "PASS",
      "summary": "Both GCC/G++ 13.3 shared C facade and C++ core executions passed with an exact five-symbol export allow-list"
    },
    {
      "command": "CMake 3.20.5 configure/build/CTest/install plus external C find_package consumer",
      "result": "PASS",
      "summary": "Two native tests and one installed-package consumer test executed and passed; a future 0.1 compatibility request was rejected"
    },
    {
      "command": "./scripts/run-engine-sanitizers.sh",
      "result": "PASS",
      "summary": "AddressSanitizer and fail-fast UndefinedBehaviorSanitizer smoke passed; LeakSanitizer remained NOT_RUN"
    },
    {
      "command": "PYTHONPATH=src <hash-locked-python> -m unittest discover -s tests -v",
      "result": "PASS",
      "summary": "50 legacy, schema, duplicate-key, requirements, retained-layout, anti-alias and atomic-write, immutable-PDF separation, checkpoint, artifact provenance and lock fail-closed, native-consumer inventory, and SBOM tests passed on Python 3.12.13"
    },
    {
      "command": "PATH=<hash-locked-report-tools>:$PATH PYTHONPATH=src make check",
      "result": "PASS",
      "summary": "Both generated reports rebuilt and validated while the immutable Engine baseline PDFs remained byte-identical and excluded from generated-report branding policy"
    },
    {
      "command": "python scripts/extract_engine_requirements.py --check",
      "result": "PASS",
      "summary": "The PDF, retained layout, 320 exact records, distributions, source fragments, hashes, schemas, derived fields, and fail-closed tracking invariants passed without Poppler"
    },
    {
      "command": "python scripts/extract_engine_requirements.py --check --extract-pdf",
      "result": "PASS",
      "summary": "pdftotext 24.02.0 output from poppler-utils 24.02.0-1ubuntu9.9 matched the retained layout after the one documented terminal-LF normalization"
    },
    {
      "command": "GitHub Actions run 31578405786",
      "result": "FAIL",
      "summary": "Native GCC, source hygiene, and REUSE jobs passed; Python 3.12 and 3.13 requirements jobs failed because pdftotext was absent on the hosted runner"
    },
    {
      "command": "GitHub Actions run 31578405812",
      "result": "FAIL",
      "summary": "Report validation reached the unified suite and failed on the same missing-pdftotext regeneration path"
    },
    {
      "command": "GitHub Actions Engine run 31581879387 on source SHA 8b41fa8435e5812b5bd10ae92e35878d9803e0bc",
      "result": "PASS",
      "summary": "Python 3.12 job 94066599023, Python 3.13 job 94066599003, source hygiene job 94066599046, native GCC/C++20 job 94066599158, and REUSE job 94066599178 completed with every step successful"
    },
    {
      "command": "GitHub Actions report run 31581879373 on source SHA 8b41fa8435e5812b5bd10ae92e35878d9803e0bc",
      "result": "PASS",
      "summary": "Report job 94066598895 completed with every step successful; transient Phase 1 artifact 9135485164 was 373119 bytes and Phase 2 artifact 9135485442 was 604306 bytes, both expire 2026-11-10 and are supplementary rather than the sole durable proof"
    },
    {
      "command": "PR 4 merge into engine at 7715a7f7897a3058473732915e372b9835317d17",
      "result": "PASS",
      "summary": "Merge tree 1a2c31b55e284edd521616c3fec7a7f017b883eb has parents fcee715a2d99517f00aacf7d8ce2797658194f83 and 66a3526f3ed5dd4263e16fbe333a4da41041f1fb"
    },
    {
      "command": "GitHub Actions engine push run 31582827407 on merge 7715a7f7897a3058473732915e372b9835317d17",
      "result": "PASS",